{"contractVersion":"1.0.0","evidenceMembers":[{"role":"EVAL_RESULT","artifact":{"id":"eval-result/specops-core-contract-integrity","reference":"eval-results/specops-core-contract-integrity.eval-result.json"},"contract":{"id":"eval-result.schema.json","reference":".specops/contracts/eval-result.schema.json","version":"1.0.0"},"contentIdentity":{"algorithm":"specops-json-jcs-sha256-v1","value":"71e20ef839af8d3d1b5f8edc66ed5ccddee63c739ee4eced8785fb0ac44c5e53"}},{"role":"EVAL_RESULT","artifact":{"id":"eval-result/specops-derived-state-consistency","reference":"eval-results/specops-derived-state-consistency.eval-result.json"},"contract":{"id":"eval-result.schema.json","reference":".specops/contracts/eval-result.schema.json","version":"1.0.0"},"contentIdentity":{"algorithm":"specops-json-jcs-sha256-v1","value":"28547294778fc761b4051c98f1f0525693bb7fee420e7670bfa9d5d54b05b660"}},{"role":"EVAL_RESULT","artifact":{"id":"eval-result/unity-clean-architecture-static","reference":"eval-results/unity-clean-architecture-static.eval-result.json"},"contract":{"id":"eval-result.schema.json","reference":".specops/contracts/eval-result.schema.json","version":"1.0.0"},"contentIdentity":{"algorithm":"specops-json-jcs-sha256-v1","value":"d8a7213950058e6ea911caff909b7e59d633b78ba7343d5661af1f140b288742"}},{"role":"EVAL_RESULT","artifact":{"id":"eval-result/unity-editmode-validation","reference":"eval-results/unity-editmode-validation.eval-result.json"},"contract":{"id":"eval-result.schema.json","reference":".specops/contracts/eval-result.schema.json","version":"1.0.0"},"contentIdentity":{"algorithm":"specops-json-jcs-sha256-v1","value":"0cbcb4466c9089418edffdec31898e31404b1dd59ad98c70e7310e6e5c50be02"}},{"role":"VALIDATION_RESULT","artifact":{"id":"validation-result/specops-v2.0.1-qualified-subject","reference":"validation-results/specops-v2.0.1-qualified-subject.validation-result.json"},"contract":{"id":"validation-result.schema.json","reference":".specops/contracts/validation-result.schema.json","version":"2.0.0"},"contentIdentity":{"algorithm":"specops-json-jcs-sha256-v1","value":"a5a9f6f7cc32b0cc755fe84e3113be346f126178dcaa343a7ff5ca9140d100c0"}},{"role":"AUDIT_RESULT","artifact":{"id":"audit-result/specops-v2.0.1-patch-delta","reference":"audit-results/specops-v2.0.1-patch-delta.audit-result.json"},"contract":{"id":"audit-result.schema.json","reference":".specops/contracts/audit-result.schema.json","version":"1.0.0"},"contentIdentity":{"algorithm":"specops-json-jcs-sha256-v1","value":"5ee95e7233a6f9371df4db35598ba93dad93a6176911b0bae60408c5588f620f"}}],"qualifiedSubject":{"id":"specops-unity-reference-implementation","revision":{"identifier":"53595414f559d884d6d34ecafa7d350c1da96955","scheme":"git-commit-sha1"},"type":"repository"},"releaseIdentity":{"identifier":"2.0.1","scheme":"semver"},"state":"DRAFT"}
