{"contractVersion":"1.0.0","evidenceMembers":[{"artifact":{"id":"eval-result/specops-core-contract-integrity","reference":"eval-results/specops-core-contract-integrity.eval-result.json"},"contentIdentity":{"algorithm":"specops-json-jcs-sha256-v1","value":"5ffe9ac8e21df61af46023a519e31cdba860e67eed750f1c6475837160a32154"},"contract":{"id":"eval-result.schema.json","reference":".specops/contracts/eval-result.schema.json","version":"1.0.0"},"role":"EVAL_RESULT"},{"artifact":{"id":"eval-result/specops-derived-state-consistency","reference":"eval-results/specops-derived-state-consistency.eval-result.json"},"contentIdentity":{"algorithm":"specops-json-jcs-sha256-v1","value":"62114a70153de7b1d325fc507646b6fe94be676af071aee3e9d44216f7fdd055"},"contract":{"id":"eval-result.schema.json","reference":".specops/contracts/eval-result.schema.json","version":"1.0.0"},"role":"EVAL_RESULT"},{"artifact":{"id":"eval-result/unity-clean-architecture-static","reference":"eval-results/unity-clean-architecture-static.eval-result.json"},"contentIdentity":{"algorithm":"specops-json-jcs-sha256-v1","value":"df36226f6c711d743d2fa6221d3f2ea7e1a05ba50cb9134dfaa3065a81b0c7d8"},"contract":{"id":"eval-result.schema.json","reference":".specops/contracts/eval-result.schema.json","version":"1.0.0"},"role":"EVAL_RESULT"},{"artifact":{"id":"eval-result/unity-editmode-validation","reference":"eval-results/unity-editmode-validation.eval-result.json"},"contentIdentity":{"algorithm":"specops-json-jcs-sha256-v1","value":"983688a97a00c2473e522b82fc7ac061acd2f2c1575a6f2dc7b8342a9b19cf97"},"contract":{"id":"eval-result.schema.json","reference":".specops/contracts/eval-result.schema.json","version":"1.0.0"},"role":"EVAL_RESULT"},{"artifact":{"id":"validation-result/specops-v2.0.0-a2","reference":"validation-results/specops-v2.0.0-a2.validation-result.json"},"contentIdentity":{"algorithm":"specops-json-jcs-sha256-v1","value":"6efd333b9b0ffc4f5cb622f3b735a02ea17f4ba0aba924a13d04355a5a45cc35"},"contract":{"id":"validation-result.schema.json","reference":".specops/contracts/validation-result.schema.json","version":"2.0.0"},"role":"VALIDATION_RESULT"},{"artifact":{"id":"audit-result/specops-v2.0.0-h3-a2","reference":"audit-results/specops-v2.0.0-h3-a2.audit-result.json"},"contentIdentity":{"algorithm":"specops-json-jcs-sha256-v1","value":"8035c462e5904c2c4033590bb1d2cf91778e7f791a55c694fd8dc79f3c920a9e"},"contract":{"id":"audit-result.schema.json","reference":".specops/contracts/audit-result.schema.json","version":"1.0.0"},"role":"AUDIT_RESULT"}],"qualifiedSubject":{"id":"specops-unity-reference-implementation","revision":{"identifier":"adddb2c91f7adae6133b384440d2c3f2020f1574","scheme":"git-commit-sha1"},"type":"repository"},"releaseIdentity":{"identifier":"2.0.0","scheme":"semver"},"state":"DRAFT"}